<?identification version="1.0" encoding="UTF-8"?>
<universityCard xmlns:xsi="http://www.w3.org/2001/XMLSchema-instance"
                    xsi:noNamespaceSchemaLocation="universityCard.xsd">
        <year>2021</year>
        <expirationDate>2022-12-13</expirationDate>
        <student>
                <firstName>KENT JHUNIOR</firstName>
                <lastName>CUADROS RAMOS</lastName>
                <dni>76517361</dni>
                <code>15200134</code>
                <incomeYear>2021-2</incomeYear>
                <career>
                        <careerName>INGENIERIA DE SOFTWARE</careerName>
                        <faculty>
                                <facultyName>INGENIERÍA DE SISTEMAS E INFORMÁTICA</facultyName>
                                <university>
                                        <universityName>UNIVERSIDAD NACIONAL MAYOR DE SAN MARCOS</universityName>
                                </university>
                        </faculty>
                </career>
        </student>
</universityCard>